{
  "id": "water_structure",
  "name": null,
  "type": "gameplay",
  "status": "optional",
  "parent_location": "tavern",
  "description": "Водоотводная или водосборная конструкция, связанная с затоплением территории.",
  "characters": [],
  "important_events": [],
  "clues": [],
  "secrets": [],
  "mechanical_features": [
    "уровень воды",
    "следы",
    "ограниченное перемещение"
  ]
}
