{
    "id": "chelax_temple",
    "name": "Храм Асмодея",
    "type": "context",
    "parent_location": null,
    "description": "Государственный храм архидьявола Асмодея в городе. Поклонение Асмодею — государственная религия в Челии. Здесь проходят публичные обряды, сбор дани, и суды над еретиками. Храм — это 'светская' сторона дьяволопоклонства (в отличие от тайного культа Асмодея в таверне, который — культ dead_wife/Официантки).",
    "characters": [
        "inquisitor"
    ],
    "important_events": [
        "сбор дани Асмодею"
    ],
    "clues": [
    ],
    "secrets": [
        "государственная религия — Асмодей",
        "пятиконечная звезда как эмблема",
        "дань Асмодею обязательна"
    ],
    "mechanical_features": [
        "государственный культ (в отличие от тайного культа в таверне)",
        "сбор дани",
        "суды над еретиками"
    ],
    "appearance": "Массивный каменный храм в центре города. Тёмные стены, чёрные купола, пять башен (намёк на Девять Преисподних). На фронтоне — пятиконечная звезда (эмблема Асмодея). Вход — через чёрные ворота. Внутри — алтарь, свечи, пахнет благовониями и воском.",
    "senses": {
        "feeling": "благоговение, строгость, порядок",
        "smell": "воск, благовония, чёрный камень",
        "sound": "эхо, шаги, шёпот молитв"
    },
    "hidden": [
    ]
}
