{
    "id": "basement",
    "name": "Подвал",
    "type": "context",
    "parent_location": "tavern",
    "description": "Подземная часть таверны — точка входа в хранилища и тайные комнаты. Сюда ведут лестница из кухни (kitchen) и второй вход с улицы, с задней стороны таверны (для незаметной загрузки/разгрузки товаров). Из подвала доступны: кладовая (kitchen_storage), ледник (meat_storage), винный погреб (wine_cellar), тайный склад контрабандистов (smuggler_storage) и логово культа (cult_lair).",
    "characters": [
        "tavern_keeper",
        "sailor",
        "waitress"
    ],
    "important_events": [
    ],
    "clues": [
    ],
    "secrets": [
        "тайная дверь в логово культа (cult_lair)",
        "через Могилу жены (wife_grave) есть вход к культистам",
        "второй вход с улицы (задняя сторона) для незаметной загрузки/разгрузки",
        "контрабанда спрятана в тайном складе (smuggler_storage)"
    ],
    "mechanical_features": [
        "коридор как точка входа в хранилища",
        "тайные двери",
        "скрытые помещения",
        "второй вход с задней стороны таверны (улица)"
    ],
    "appearance": "Тёмный, сырой коридор под таверной. Каменные стены, покрытые мхом. Низкий потолок. Вдоль стен — несколько дверей: в кладовую, в ледник, в винный погреб, в тайный склад. В дальнем углу — тайная дверь, замаскированная под стеллаж, ведёт в логово культа. Второй вход — с улицы, с задней стороны таверны. Пахнет сыростью, вином, рыбой и благовониями.",
    "senses": {
        "feeling": "холод, тайна, страх",
        "smell": "сырость, вино, рыба, мясо, благовония",
        "sound": "капли, шёпот, скрип тайной двери"
    },
    "hidden": [
        {
            "description": "Тайная дверь в логово культа (замаскирована под стеллаж)",
            "evidence": [
                "cult_lair"
            ],
            "check": {
                "skill": "Внимательность",
                "dc": 15,
                "success": "игрок замечает тайную дверь, замаскированную под стеллаж — ведёт в логово культа (cult_lair)",
                "failure": "просто стеллажи; тайной двери нет"
            }
        }
    ]
}
