{
    "id": "dusk_market",
    "name": "Сумеречный рынок (Dusk Market)",
    "type": "gameplay",
    "parent_location": "town",
    "description": "«Сумеречный рынок» (Dusk Market) - блуждающий базар, который появляется в руинах северной части города (Парего Доспера, Рего Кадер — «Мертвый Сектор») и никогда не остаётся на одном месте дважды. Здесь можно найти всё, что запрещено законом: наркотики (пеш, лист-живодёр, грязь), рабов, яды, странных существ и проституток. Это штаб-квартира многих криминальных организаций и лучшее место для теневых сделок. Покупка запрещённых товаров (Devil's Bane и др., см. smugglers) — через Сумеречный рынок.",
    "characters": [],
    "important_events": [
        "теневые сделки, покупка запрещённых товаров"
    ],
    "clues": [],
    "secrets": [
        "Сумеречный рынок — блуждающий базар: никогда не остаётся на одном месте дважды",
        "продается всё запрещённое: наркотики, рабы, яды, странные существа, проститутки",
        "штаб-квартира многих криминальных организаций; связь с Советом Воров (council_of_thieves)",
        "покупка Devil's Bane (погибель дьявола) — через Сумеречный рынок (smugglers)"
    ],
    "mechanical_features": [
        "покупка запрещённых товаров (Devil's Bane, Pesh, Flayleaf, Grit — инструменты культа Дагона)",
        "теневые сделки, заказные убийства, работорговля",
        "встречи с криминальными группировками",
        "переход через улицы города (city_streets)"
    ],
    "appearance": "Блуждающий базар в руинах северной части города. Тёмные палатки, фонари, туман. Лавки с ядами, наркотиками, рабами, странными существами. Теснота, толпа, шёпот. Пахнет дымом, гнилью, порохом.",
    "senses": {
        "feeling": "опасность, тайна, теснота",
        "smell": "дым, гниль, порох, яды",
        "sound": "шёпот, торги, далёкие крики, тишина"
    },
    "hidden": [
        {
            "description": "Штаб-квартиры криминальных организаций; скрытые сделки с Советом Воров (council_of_thieves).",
            "evidence": []
        }
    ]
}
