{
    "id": "tavern_hall",
    "name": "Зал таверны",
    "type": "gameplay",
    "parent_location": "tavern",
    "description": "Главное общее помещение таверны. На видном месте висит портрет жены Трактирщика (dead_wife).",
    "characters": [
        "tavern_keeper",
        "waitress",
        "doctor",
        "detective",
        "artist",
        "sailor",
        "dead_wife"
    ],
    "important_events": [
        "event_014"
    ],
    "clues": [
        "wife_portrait"
    ],
    "secrets": [
        "портрет жены (dead_wife) на видном месте",
        "призрак dead_wife иногда появляется рядом с портретом"
    ],
    "mechanical_features": [
        "допросы",
        "наблюдение за реакциями NPC",
        "публичные конфликты",
        "случайно услышанные разговоры",
        "портрет жены как деталь интерьера"
    ],
    "appearance": "Большое помещение с низкими деревянными балками под потолком. Четыре длинных стола расставлены вдоль стен, к каждому приделана лавка. В центре зала — один большой каменный очаг, в котором потрескивает огонь. На стене на видном месте — портрет красивой женщины. По стенам — окна. В одном углу — лестница на второй этаж (во фойе), рядом — дверь в подвал. С задней стороны (восточной) — дверь на хозяйственный двор (backyard), с западной — главный вход со двора (tavern_yard).",
    "senses": {
        "feeling": "тепло, но напряжение",
        "smell": "дым, эль, жареное мясо, воск свечей",
        "sound": "треск огня, скрип половиц, голоса гостей"
    },
    "hidden": [
        {
            "description": "Портрет жены Трактирщика",
            "evidence": [
                "wife_portrait"
            ]
        },
        {
            "description": "Семейное древо",
            "evidence": [
                "family_tree"
            ]
        },
        {
            "description": "Эктоплазма (след призрака — портрет как точка присутствия dead_wife; место одержимости)",
            "evidence": [
                "ectoplasm"
            ],
            "check": {
                "skill": "Оккультизм",
                "dc": 12,
                "success": "за/на портрете — эктоплазма (след призрака); dead_wife здесь обитает; точка одержимости Трактирщика",
                "failure": "просто портрет; никаких следов"
            }
        }
    ]
}
