{
    "id": "town_gate",
    "name": "Городские ворота",
    "type": "gameplay",
    "parent_location": "town",
    "description": "Городские ворота. Связывают улицы города (city_streets) и тракт (bridge). Один из точек перехода из города в город через улицы.",
    "characters": [
    ],
    "important_events": [
    ],
    "clues": [
    ],
    "secrets": [
    ],
    "mechanical_features": [
        "городские ворота: связь с улицами города (city_streets)",
        "городские ворота: связь с трактом (bridge)"
    ],
    "appearance": "Массивные ворота из камня и дерева. Стрельницы, козлы, цепи. Рядом — страж, лавки. Пахнет пылью, деревом, железом.",
    "senses": {
        "feeling": "строго, официально",
        "smell": "пыль, дерево, железо",
        "sound": "скрип ворот, шаги стражи"
    },
    "hidden": [
    ]
}
