{
    "id": "city_streets",
    "name": "Улицы Весткроуна",
    "type": "gameplay",
    "parent_location": "town",
    "description": "Улицы Весткроуна (Westcrown) — «Города Сумерек», бывшей столицы Челии — активная игровая локация. Место серии смертей членов культа Дагона (previous_crime_scenes). Здесь детектив ведёт расследование, а Художник тайно охотится на культистов Дагона. Улицы обветшали, по ночам их терроризируют теневые звери (shadow beasts), привезённые из соседнего Нидала (Nidal); из-за них введён **комендантский час** и ночная жизнь замирает. В сердце торгового района — огромное здание **Тривардум (Trivardum)**: центр коммерции, где в одном шиферном здании сосредоточены магазины, таверны, офисы правительства и даже послов. Реальная сила в городе — торговля и Совет Воров (council_of_thieves), а не городская власть (city_authority). Из улиц города ведут Мост Клинкокрыла (Bladewing Bridge, bladewing_bridge) к тракту, а по реке Адивиан (river) — порт (port) к причалу.",
    "characters": [
        "detective",
        "artist",
        "duxotar"
    ],
    "important_events": [
        "убийства членов культа Дагона Художником"
    ],
    "clues": [
    ],
    "secrets": [
        "реальная власть в Весткроуне — торговля и Совет Воров (council_of_thieves), а не городская власть",
        "по ночам улицы терроризируют теневые звери (shadow beasts) из Нидала (Nidal); из-за них введён комендантский час",
        "Тривардум (Trivardum) — центр торговли: магазины, таверны, офисы правительства и послов в одном здании",
        "Тривардум (Trivardum) находится в Рего Лаина (Парего Регикона); значительно южнее Крепости Дотари (keep_dottar)",
        "Крепость Дотари (keep_dottar) — штаб rundottari, в Рего Кадер (Парего Доспе́ра), у стены Обериган; НЕ штаб Дуксотара всего Весткроуна",
        "Ducotrion — комплекс штабных помещений городской стражи, кабинеты старших офицеров (упоминается в Hell Comes to Westcrown)"
    ],
    "mechanical_features": [
        "расследование серии смертей",
        "встречи с NPC (Дуксотар, Мэр)",
        "Тривардум (Trivardum): закупки, найм специалистов, сбор слухов о торговых делах",
        "переход к городу через Мост Клинкокрыла (Bladewing Bridge, bladewing_bridge)",
        "переход к порту по реке Адивиан (port)"
    ],
    "appearance": "Улицы Весткроуна — «Города Сумерек»: каменные мостовые, лавки, трактиры, узкие переулки. Обветшанные дома, алeи. В некоторых местах — тёмные переулки, заброшенные дома. В торговом районе доминирует огромное здание Тривардум (Trivardum) с шиферной крышей. Следы крови, ритуальные символы Дагона. По ночам — тени (теневые звери из Нидала), комендантский час. Пахнет смертью, страхом, солью и гнилью (река Адивиан).",
    "senses": {
        "feeling": "ужас, тайна",
        "smell": "кровь, разложение, воск",
        "sound": "тишина, эхо, далёкие голоса"
    },
    "hidden": [
    ]
}
