{
    "id": "guest_room_empty_3",
    "name": "Пустая комната №3",
    "type": "gameplay",
    "parent_location": "guest_rooms",
    "description": "Пустая комната гостя, которую ещё не сдали. Может быть снята игроками. Стандартная расстановка мебели с лёгкой индивидуальностью: забытые вещи прошлых жильцов.",
    "characters": [
    ],
    "important_events": [
    ],
    "clues": [
    ],
    "secrets": [
        "забытая фотография и фляжка прошлых жильцов (не связаны с текущим убийством)",
        "комнату могут снять игроки"
    ],
    "mechanical_features": [
        "комнату могут снять игроки",
        "забытые вещи прошлых жильцов",
        "стандартная расстановка мебели",
        "лёгкая индивидуальность"
    ],
    "appearance": "Тёплая комната с деревянной кроватью. Кровать, стол, стул, окно. На столе — забытая фотография прошлых жильцов, полупустая фляжка, пара книг. В углу — чужой сундук, приоткрытый. На стене — крючок с пустым вешалом. На полу — следы от старой мебели. Пахнет пылью, старым деревом и лёгким запахом мазута.",
    "senses": {
        "feeling": "пустота, следы прошлых жильцов",
        "smell": "пыль, старый дуб, мазут",
        "sound": "тишина, скрип половиц, далёкий храп"
    },
    "hidden": [
    ]
}
