{
    "id": "tavern_keeper_room",
    "name": "Комната Трактирщика",
    "type": "gameplay",
    "parent_location": "guest_rooms",
    "description": "Личная комната Трактирщика на 2-м этаже. Здесь он спит. Кабинет на 1-м этаже (tavern_keeper_office) — рабочее; комната — личное. В комнате личные вещи, но основные улики (дневник, записная книжка, письмо Моряка, яд, долговая расписка) — в кабинете.",
    "characters": [
        "tavern_keeper"
    ],
    "important_events": [
    ],
    "clues": [
    ],
    "secrets": [
        "комната отдельна от кабинета — личные вещи отделены от рабочих"
    ],
    "mechanical_features": [
        "обыск комнаты",
        "личные вещи Трактирщика",
        "связь с кабинетом (tavern_keeper_office)"
    ],
    "appearance": "Небольшая, тесная комната на 2-м этаже. Кровать, стол, стул, шкаф с бумагами. На стене — полка с книгами (некоторые — запрещённые). В комнате — камин. Окно. Пахнет пылью, старой бумагой и лёгким запахом спирта.",
    "senses": {
        "feeling": "тайна, напряжение",
        "smell": "пыль, бумага, чернила, лёгкий запах спирта",
        "sound": "тишина, скрип стула, треск камина"
    },
    "hidden": [
    ]
}
