{
    "id": "chernaya_sirena",
    "name": "Чёрная Сирена (La Sirena Nera)",
    "type": "gameplay",
    "parent_location": "port",
    "description": "Корабль «Чёрная Сирена» (La Sirena Nera) — крупный парусник, стоящий в порту Весткроуна (port). На нём Моряк служил матросом, а Врач — судовым врачом. Капитаном корабля является capitan (отдельный персонаж, «Солёный Алехандро» Алессандро Маретти). Моряк дезертировал с корабля, украв судовую казну. Капитан знает о дезертирстве и краже казны; он может встречаться с игроками в порту (port) или в торговом центре Тривардум (trivardum).",
    "characters": [
        "capitan"
    ],
    "important_events": [
        "служба Моряка",
        "дезертирство Моряка",
        "кража судовой казны"
    ],
    "clues": [],
    "secrets": [
        "Моряк дезертировал с корабля и украл судовую казну",
        "Врач был судовым врачом на «Чёрной Сирене» (sirena_nera_crew)",
        "Капитан (capitan) знает о дезертирстве и краже; не знает, что Моряк в таверне"
    ],
    "mechanical_features": [
        "встречи с Капитаном (capitan) — он в порту или в Тривардуме (trivardum)",
        "дезертирство/кража казны — ключевая улика против Моряка"
    ],
    "appearance": "Большой парусник, стоящий в порту. Пахнет солью, рыбой, порохом. На борту — команда. Капитан — суровый мужчина (capitan). Врач и Моряк когда-то служили здесь.",
    "senses": {
        "feeling": "свобода, опасность",
        "smell": "соль, рыба, порох",
        "sound": "скрип мачт, крики чаек, команды"
    },
    "hidden": [
        {
            "description": "Судовые записи о дезертирстве Моряка и краже казны; связь с Капитаном (capitan).",
            "evidence": []
        }
    ]
}
