{
    "id": "kitchen",
    "name": "Кухня",
    "type": "gameplay",
    "parent_location": "tavern",
    "description": "Хозяйственная кухня таверны за залом. Здесь готовит Официантка, здесь Трактирщик принимает Моряка с контрабандой, и здесь (вечером) вспыхивает конфликт между Доктором и Трактирщиком из-за отношений Доктора с Официанткой. Сцена 19:30 (привязка сценария, event_028, глава 2): на кухне голоса Трактирщика и Доктора переходят в ссору, Доктор выбегает, хлопнув дверью, и уходит в свою комнату на 2 этаже.",
    "characters": [
        "tavern_keeper",
        "waitress",
        "doctor"
    ],
    "important_events": [
    ],
    "clues": [
    ],
    "secrets": [
        "конфликт Доктора и Трактирщика (есть ли связь с текущим убийством — определяется автором)",
        "Трактирщик тайно принимает контрабанду Моряка (event_005) — возможна загрузка через кухню/подвал",
        "запах благовоний культа (след Официантки, см. waitress.senses)"
    ],
    "mechanical_features": [
        "приготовление ужина (19:30)",
        "тайная загрузка контрабанды (связь с basement, smuggler_storage)",
        "публичный конфликт Доктора и Трактирщика (повышенный тон, хлопок дверью)",
        "шум/эхо из-за двери (случайно услышанные разговоры из tavern_hall)",
        "потоп: кухня на уровне 1 этажа — затапливается на уровне земли/1 этажа (см. flood_mechanic)"
    ],
    "appearance": "Тесное, жаркое помещение. Медные кастрюли, крюки для мяса, прилавок из тёмного дерева; полки с посудой. В ряд выстроены три печи с очагами. У окна стоит работающий стол. В углу — кресло и низкий столик (уголок, где Трактирщик сидит в перерывах). Камины: один отделяет кухню от зала, другой — в кабинете Трактирщика. Пахнет жареным мясом, вином, дымом и — странно — благовониями.",
    "senses": {
        "feeling": "жара, напряжение, тайна",
        "smell": "жареное мясо, вино, дым, благовония",
        "sound": "стук ножа, плеск воды, голоса из-за двери, хлопанье дверью"
    },
    "hidden": [
        {
            "description": "Запах благовоний культа (след Официантки)",
            "evidence": [],
            "check": {
                "skill": "Внимательность",
                "dc": 12,
                "success": "игрок замечает странный запах благовоний/магии среди кухонных запахов — след Официантки (культовистка)",
                "failure": "просто пахнет едой и вином"
            }
        }
    ]
}
