{
    "id": "barn",
    "name": "Каретный сарай и мастерская",
    "type": "gameplay",
    "parent_location": "tavern_yard",
    "description": "Каретный сарай и мастерская в северо-западной части двора таверны (tavern_yard), у забора. Здесь знатные гости оставляют кареты, а таверна хранит две обычные хозяйственные повозки. В сарае есть свободные места для нескольких экипажей, верстак, стойка инструментов, малый горн с наковальней, запасные колёса, оси, оглобли и приспособления для ремонта. Рядом — широкие ворота каретного сарая (carriage-gate) во двор; из сарая есть выход на двор (tavern_yard).",
    "characters": [],
    "important_events": [],
    "clues": [],
    "secrets": [],
    "mechanical_features": [
        "широкие ворота каретного сарая (carriage-gate): связь с двором (tavern_yard)",
        "две хозяйственные повозки таверны и свободные места для 3–5 карет",
        "верстак, инструменты, малый горн и наковальня",
        "запасные колёса, оси, оглобли, домкрат и подставки",
        "место для скрывания/спрятанных вещей"
    ],
    "appearance": "Просторное деревянное строение из грубого бревна в северо-западной части двора. Широкие ворота ведут внутрь; внутри — две обычные хозяйственные повозки, свободные места для карет знатных гостей, верстак, стойка с инструментами, маленький горн и наковальня, запасные колёса, оси и оглобли. На полу — следы колёс, стружка и тёмные пятна смазки. Пахнет старым деревом, дёгтем, маслом, железом и влажной землёй.",
    "senses": {
        "feeling": "рабочая основательность, сумрак",
        "smell": "дерево, дёготь, масло, железо, пыль, влажная земля",
        "sound": "скрип ворот, эхо шагов, стук инструмента, плеск"
    },
    "hidden": []
}
