{
    "id": "attic_room_1",
    "name": "Чердачная комната №1 (косой потолок)",
    "type": "gameplay",
    "parent_location": "mansard",
    "description": "Чердачная комната с косым потолком на мансарде. Одна из трёх чердачных комнат, отделённых от мастерской дверью. Тесное помещение с низким потолком, скошенными балками, пылью. Здесь спрятан тайник Художника (artist_hiding): сундук с «Погибелью Дьявола» (Devil's Bane) и склянки с наркотиками (Слёзы Размира, Эфир, Белладонна) — топливо безумия/падения. Может быть занята игроками.",
    "characters": [
        "artist"
    ],
    "important_events": [
        "event_021"
    ],
    "clues": [
        "artist_hiding",
        "devil_bane_residue",
        "tears_razmir",
        "aether",
        "belladonna"
    ],
    "secrets": [
        "Тайник Художника (artist_hiding) — сундук с «Погибелью Дьявола» и наркотиками",
        "комнату могут снять игроки",
        "забытые вещи прошлых жильцов (не связано с текущим убийством)"
    ],
    "mechanical_features": [
        "дверь в мастерскую (mansard)",
        "косой потолок",
        "обыск",
        "тайник (сундук)"
    ],
    "appearance": "Тесная чердачная комната с косым потолком. Скошенные балки, пыль, низкий потолок. В углу — сундук (тайник Художника): в нём — склянки с мазью «Погибель Дьявола» и склянки с наркотиками (Слёзы Размира, Эфир, Белладонна). На полу — следы грязи, ведущие к лестнице. Пахнет пылью, деревом и дымом.",
    "senses": {
        "feeling": "пустота, косой потолок, тайна",
        "smell": "пыль, старый дуб, дым",
        "sound": "скрип половиц, ветер в окне"
    },
    "hidden": [
        {
            "description": "Тайник Художника (сундук)",
            "evidence": [
                "artist_hiding"
            ],
            "check": {
                "skill": "Внимательность",
                "dc": 15,
                "success": "игрок находит тайник/сундук Художника (двойное дно) — внутри: «Погибель Дьявола» и наркотики (топливо безумия/падения)",
                "failure": "просто старый сундук; тайника не замечено"
            }
        },
        {
            "description": "«Погибель Дьявола» (Devil's Bane)",
            "evidence": [
                "devil_bane_residue"
            ],
            "check": {
                "skill": "Внимательность",
                "dc": 15,
                "success": "игрок находит следы/склянки мазь «Погибель Дьявола» — запрещённый в Челии инструмент культа Дагона",
                "failure": "просто пыль/следы; назначения неясно"
            }
        },
        {
            "description": "Слёзы Размира (Tears of Razmir)",
            "evidence": [
                "tears_razmir"
            ],
            "check": {
                "skill": "Внимательность",
                "dc": 15,
                "success": "игрок находит Слёзы Размира — наркотик/топливо безумия Художника",
                "failure": "просто склянки; не замечено"
            }
        },
        {
            "description": "Эфир (Aether)",
            "evidence": [
                "aether"
            ],
            "check": {
                "skill": "Внимательность",
                "dc": 15,
                "success": "игрок находит эфир — седатив/внушение, топливо падения Художника",
                "failure": "просто склянки; не замечено"
            }
        },
        {
            "description": "Белладонна (Belladonna)",
            "evidence": [
                "belladonna"
            ],
            "check": {
                "skill": "Внимательность",
                "dc": 15,
                "success": "игрок находит белладонну — яд/галлюциноген, топливо безумия Художника",
                "failure": "просто склянки; не замечено"
            }
        }
    ]
}
