{
    "id": "dock",
    "name": "Пристань",
    "type": "gameplay",
    "parent_location": "tavern",
    "description": "Пристань у подножия таверны, на берегу реки. Привязана к Матросу (sailor) и контрабандистам (smugglers): через пристань идёт контрабанда — ялик пришвартован у пристани, парус на фок-мачте поднят (игроки видят его с моста по прибытии). Один из путей решения потопа — отвязать ялик от пристани (на ранних этапах) и переждать потоп на ялике (если Матрос и культисты мертвы, а логово культа к тому моменту уже затоплено).",
    "characters": [
        "sailor"
    ],
    "important_events": [
    ],
    "clues": [
        "evidence_047"
    ],
    "secrets": [
        "тайный груз контрабандистов (smugglers)",
        "ялик — единственный способ уйти при потопе (путь решения: отвязать ялик)",
        "Матрос здесь грузит/привозит запрещённые товары (связь с basement, tavern_storage)"
    ],
    "mechanical_features": [
        "ялик (средство спасения при потопе)",
        "парус на фок-мачте поднят (видно с моста)",
        "контрабанда через реку",
        "потоп: нижняя точка — затапливается первой (см. flood_mechanic)"
    ],
    "appearance": "Деревянная пристань у подножия таверны, на берегу реки. Мокрый борт, тросы, лестница на воду. У причала пришвартован ялик с поднятым парусом. Вокруг — вода, лодки, запах соли и гнили.",
    "senses": {
        "feeling": "запах воды, теснота, тайна",
        "smell": "соль, гниль, дёготь, ром",
        "sound": "плеск воды, скрип тросов, прибой"
    }
}
