{
    "id": "trivardum",
    "name": "Тривардум (Trivardum)",
    "type": "gameplay",
    "parent_location": "town",
    "description": "Тривардум (Trivardum) — центр торговли и коммерции Весткроуна. Это огромное здание с шиферной крышей, которое вмещает в себя всё: от многочисленных магазинов и таверн до офисов правительства и даже послов. Лучшее место для закупок, найма специалистов и сбора слухов о торговых делах. Здесь торгуют, нанимают, заключают сделки; сюда приходят, чтобы затеряться в толпе или наоборот — быть на виду. В торговом районе доминирует это здание; рядом находится офис Дуксотара (duxotar_office).",
    "characters": [
        "ship_captain"
    ],
    "important_events": [
        "наём специалистов, закупки, сбор слухов"
    ],
    "clues": [],
    "secrets": [
        "центр коммерции Весткроуна: магазины, таверны, офисы правительства и послов в одном здании",
        "лучшее место для закупок, найма специалистов и сбора слухов о торговых делах",
        "здесь можно найти контрабандистов или затеряться в толпе",
        "расположение: Рего Лаина (Парего Регикона); значительно южнее Крепости Дотари (keep_dottar, Рего Кадер)",
        "рядом — офис Дуксотара (duxotar_office); но Крепость Дотари и штаб Дуксотара всего Весткроуна — не одно и то же"
    ],
    "mechanical_features": [
        "закупки редких товаров",
        "найм специалистов",
        "сбор слухов о торговых делах",
        "встречи с NPC (Дуксотар, Капитан, Мэр)",
        "переход через улицы города (city_streets)"
    ],
    "appearance": "Огромное здание с шиферной крышей, доминирующее над торговым районом. Множество витрин, лавок, вывесок. Толпа покупателей, торговцев, бюрократов. Внутри — лабиринт магазинов, таверн, офисов и залов. Пахнет специями, бумагой, вином.",
    "senses": {
        "feeling": "суета, торговля, шум",
        "smell": "специи, бумага, вино, чернила",
        "sound": "торговцы, клиенты, переклички, скрип пера"
    },
    "hidden": [
        {
            "description": "Офисы правительства и послов внутри здания; скрытые встречи с контрабандистами (smugglers).",
            "evidence": []
        }
    ]
}
