{
    "id": "foyer_2f",
    "name": "Фойе 2-го этажа",
    "type": "gameplay",
    "parent_location": "tavern",
    "description": "Фойе второго этажа таверны. Сюда ведёт лестница из общего зала (tavern_hall). Из фойе идёт лестница на мансарду (mansard) и выход в коридор второго этажа (guest_rooms) — коридор ведёт к комнатам жильцов и постояльцев.",
    "characters": [
    ],
    "important_events": [
    ],
    "clues": [
    ],
    "secrets": [
    ],
    "mechanical_features": [
        "лестница из общего зала (tavern_hall) — вход на 2 этаж",
        "лестница на мансарду (mansard)",
        "выход в коридор 2-го этажа (guest_rooms)"
    ],
    "appearance": "Короткий вестибюль на лестнице второго этажа. Лестничный пролёт, перила, масляная лампа. Из фойе — дверь в коридор и крутая лестница наверх, к мансарде. Пахнет пылью, деревом и старой краской.",
    "senses": {
        "feeling": "напряжение, тайна",
        "smell": "пыль, старый дуб, краска",
        "sound": "скрип половиц, эхо лестницы"
    },
    "hidden": [
    ]
}
