{
    "id": "town",
    "name": "Весткроун (Westcrown) — «Город Сумерек»",
    "type": "context",
    "description": "Весткроун (Westcrown) — «Город Сумерек» (City of Twilight), бывшая столица Челии, ныне портовый город в устье реки Адивиан (Adivian River), ~150 миль к югу от Эгориана. Город пришёл в упадок после смерти бога Ародена (4606 AR) и гражданской войны; улицы обветшали, по ночам их терроризируют теневые звери (shadow beasts) из соседнего Нидала, из-за чего введён комендантский час. В городе произошла серия смертей, расследуемая Детективом. Реальная сила — торговля и Совет Воров (council_of_thieves), а не городская власть (city_authority); центром коммерции служит огромное здание Тривардум (Trivardum). Орден Дыбы (Order of the Rack, один из семи основных орденов Адских рыцарей) расквартирован в городе (Тараник-Хаус, район Рего Скрипа; не менее 15 рыцарей, ротация каждые две недели, командир — паралихтор Гонвиль Шард). Предшественник: 4573 AR «Белая Чума» (культ Сифкеш, «Путь Благодати») → создание Ордена Дыбы. По реке Адивиан (river) ведёт к порту (port) и причалу (pier).",
    "characters": [
        "duxotar",
        "detective",
        "artist"
    ],
    "important_events": [
        "серия смертей членов культа Дагона"
    ],
    "clues": [
    ],
    "secrets": [
        "реальная власть в Весткроуне — торговля и Совет Воров (council_of_thieves), а не городская власть",
        "4573 AR «Белая Чума» (культ Сифкеш) → создание Ордена Дыбы",
        "по ночам улицы терроризируют теневые звери (shadow beasts) из Нидала (Nidal); из-за них — комендантский час",
        "Тривардум (Trivardum) — центр коммерции: магазины, таверны, офисы правительства и послов",
        "Теневые звери (shadow beasts) — прислужники вампира Илнерика (Ilnerik); часть осталась в городе после его смерти",
        "Механика теневых зверей: выходят только ночью, не заходят в дома (если не summoned/created) и убивают животных",
        "Комендантский час — 18:00 (восемнадцать ноль-ноль)",
        "Тараник-Хаус (Taranik House, Рего Скрипа) — ныне гарнизон Ордена Дыбы; изначально дом Мисирнис Тараник, либерального философа и тайной участницы культа Сифкеш (Сифкеш, «Путь Благодати»), организовавшей «Белую Чуму»; сожжена вместе с домом Дайдианом Руэлем и его последователями",
        "Крепость Дотари (keep_dottar) — штаб rundottari (стражи руин), в Рего Кадер (Парего Доспе́ра), у стены Обериган; НЕ штаб Дуксотара всего Весткроуна",
        "Тривардум (Trivardum) — в Рего Лаина (Парего Регикона), значительно южнее Крепости Дотари",
        "Ducotrion — комплекс штабных помещений городской стражи, кабинеты старших офицеров (Hell Comes to Westcrown)",
        "Стена Обериган (Oberigan Wall) — городская стена, у которой стоит Крепость Дотари"
    ],
    "appearance": "Весткроун — «Город Сумерек»: город вдалеке, за водой (река Адивиан). Видны обветшавшие крыши, шпили, дым; в торговом районе — огромное здание Тривардум (Trivardum) с шиферной крышей. По улицам — тени (теневые звери из Нидала), комендантский час. Город — место серии смертей, которые расследует Детектив. Атмосфера упадка, изоляции и тайных культов.",
    "senses": {
        "feeling": "тревога, упадок",
        "smell": "дым, вода, соль, гниль (река Адивиан)",
        "sound": "ветер, далёкие голоса, прибой, гул торгового рынка (Тривардум)"
    }
}