{
    "id": "duxotar_office",
    "name": "Офис Дуксотара",
    "type": "gameplay",
    "parent_location": "town",
  "description": "Сцена C3 (Приёмная Дуротаса) — штаб/казармы Common Dottari у Рего Скрипа: место, откуда партия получает официальное расследование серии смертей. Здесь партия встречает Дуротаса Сарию Рокцин (saria_roccin, Common dottari) — наиболее честного из четырёх дуротасов; она нанимает Детектива (Джакомо Раньери) за собственный счёт и может нанять партию, выдаёт «Бумаги о сотрудничестве». Дуксотар (duxotar, Илтус Мартис) — формальный командир доттари и наниматель Детектива; он некомпетентен и вечно пьян, подписывает, но не командует; реальная власть в страже — у 4 дуротасам. За видимой городской властью (city_authority) стоит Совет Воров (council_of_thieves) — реальная сила.",
  "characters": [
    "saria_roccin",
    "detective"
  ],
  "important_events": [
    "Дуксотар нанимает Детектива",
    "Дуротас Сария Рокцин принимает партию и выдаёт «Бумаги о сотрудничестве» (сцена C3)"
  ],
    "clues": [
    ],
    "secrets": [
        "Дуксотар (Илтус Мартис) — некомпетентен и вечно пьян; реальная власть в страже — у 4 дуротасам",
        "Дуксотар — племянник лорд-мэра Абериана Арванкси; власть опирается на родство, а не компетентность",
        "за видимой городской властью (city_authority) стоит Совет Воров (council_of_thieves)",
        "Дуксотар — командир городской стражи в целом; Крепость Дотари (keep_dottar) — штаб rundottari, одного из подразделений, НЕ то же, что штаб Дуксотара",
        "Ducotrion — отдельный комплекс штабных помещений стражи, кабинеты старших офицеров (Hell Comes to Westcrown)"
    ],
    "appearance": "Небольшое здание в городе. Стол, шкаф с делами, карта города на стене, латунная табличка «Дуксотар». Пахнет бумагой, чернилами и алкоголем (фляжка Дуксотара).",
    "senses": {
        "feeling": "официальность, напряжение",
        "smell": "бумага, чернилы, алкоголь",
        "sound": "тишина, скрип пера, далёкие голоса"
    },
    "hidden": [
        {
            "description": "Деловое дело серии убийств и записная книжка Детектива Джакомо Раньери",
            "evidence": [
                "tavernkeeper_diary"
            ],
            "check": {
                "skill": "Внимательность",
                "dc": 15,
                "success": "игрок замечает открытое дело с перечнем тел и записями Детектива Джакомо Раньери о серии убийств",
                "failure": "просто стопка бумаг; ничего не бросается в глаза"
            }
        }
    ]
}