{
    "id": "wine_cellar",
    "name": "Винный погреб",
    "type": "gameplay",
    "parent_location": "basement",
    "description": "Винный погреб: бочки с вином и эль. Хранилище для напитков таверны. Связано с залом (tavern_hall) — оттуда сюда уносят бутылки.",
    "characters": [
        "tavern_keeper",
        "sailor"
    ],
    "important_events": [
    ],
    "clues": [
    ],
    "secrets": [
    ],
    "mechanical_features": [
        "склад вина и эля",
        "бочки, бочки, бутылки",
        "связь с залом (tavern_hall)"
    ],
    "appearance": "Тёмное, влажное помещение. Каменные стены, низкий потолок. Вдоль стен — бочки с вином и эль, бутылки на полках. На полу — лужи от протечек. Свет — от масляной лампы. Пахнет вином, эль, сыростью, старым деревом.",
    "senses": {
        "feeling": "сырость, застой",
        "smell": "вино, эль, сырость, старый дуб",
        "sound": "капли воды, скрип бочек"
    },
    "hidden": [
    ]
}
