{
    "id": "detective_room",
    "name": "Комната Детектива",
    "type": "gameplay",
    "parent_location": "guest_rooms",
    "description": "Комната гостя, которую занял Детектив. Здесь он спит и записывает наблюдения. Постоянно пьян: бутылки, запахи, пятна на одежде. Случайная смерть (accident) могла произойти здесь по неосторожности во время пьянки.",
    "characters": [
        "detective"
    ],
    "important_events": [
        "event_011",
        "event_012"
    ],
    "clues": [
        "detective_drunk",
        "broken_bottle"
    ],
    "secrets": [
        "Детектив постоянно пьян, но это НЕ улика на убийство"
    ],
    "mechanical_features": [
        "обыск комнаты",
        "следы пьянства (бутылки, пятна)",
        "разбитая бутылка как ложный след орудия",
        "ночные записи Детектива (записная книжка)"
    ],
    "appearance": "Кровать, стол, стул, окно. На столе — блокнот, карандаш, чернильница, стопка исписанных листов. В углу — фляжка и несколько пустых бутылок. На полу — разбитая бутылка из-под крепкого алкоголя, с отпечатками. В комнате — камин. На одежде Детектива — пятна. Пахнет алкоголем, потом и старым деревом.",
    "senses": {
        "feeling": "напряжение, неосторожность",
        "smell": "алкоголь, пот, старый дуб, чернила",
        "sound": "бормотание во сне, скрип половиц, тихий хруст стекла, треск камина"
    },
    "hidden": [
        {
            "description": "Следы пьянства Детектива",
            "evidence": [
                "detective_drunk"
            ],
            "check": {
                "skill": "Внимательность",
                "dc": 10,
                "success": "игрок замечает следы пьянства (бутылки, пятна, запах) — ложный след орудия (случайная смерть accident, НЕ убийство)",
                "failure": "просто комнатa гостя"
            }
        },
        {
            "description": "Разбитая бутылка",
            "evidence": [
                "broken_bottle"
            ],
            "check": {
                "skill": "Внимательность",
                "dc": 10,
                "success": "игрок замечает разбитую бутылку с отпечатками — красная сельдь (выглядит как орудие, но не орудие)",
                "failure": "разбитая бутылка не замечена"
            }
        }
    ]
}
