{
    "id": "cult_lair",
    "name": "Логово культа",
    "type": "gameplay",
    "parent_location": "basement",
    "description": "Тайное святилище КУЛЬТА ДАГОНА (demon, Chaos — запрещённая ересь в Челии; государственная религия — Асмодей). Один из входов через Могилу жены (wife_grave). Дагон — демон-лорд океана; его ритуал (молитва Официантки) вызвал потоп (event_016), усиленный паводком реки Адивиан.",
    "characters": [
        "waitress",
        "doctor",
        "dead_wife"
    ],
    "important_events": [
        "event_015",
        "event_016"
    ],
    "clues": [
        "cult_items",
        "wife_ghost"
    ],
    "secrets": [
        "существование культа Дагона",
        "роль Официантки как верховной жрицы культа Дагона",
        "участие Врача в культе Дагона",
        "вход через Могилу жены",
        "призрак dead_wife обитает рядом с входом",
        "ритуал Дагона (молитва Официантки) вызвал потоп (event_016)"
    ],
    "mechanical_features": [
        "религиозные символы Дагона",
        "ритуальные предметы",
        "доказательства существования культа Дагона"
    ],
    "appearance": "Тайное святилище культа Дагона под подвалом. Круглое помещение с алтарём в центре. На стенах — символы Дагона (демон-лорд океана): волны, морские чудовища, череп. Свечи, ритуальные предметы, печать культа. В углу — ковчег, прикрытый тканью. За алтарём — ритуальный кинжал. Пахнет благовониями, воском, кровью и солёной морской гнилью (Дагон).",
    "senses": {
        "feeling": "страх, благоговение, зло",
        "smell": "благовония, воск, кровь, тёмная магия",
        "sound": "эхо, шёпот, капли"
    },
    "hidden": [
        {
            "description": "Ритуальные предметы культа",
            "evidence": [
                "cult_items"
            ],
            "check": {
                "skill": "Религия",
                "dc": 15,
                "success": "игрок распознаёт святилище культа Дагона: ритуальные предметы, свечи, символы Дагона (волны, череп, морские чудовища); это тайная ересь, запрещённая в Челии",
                "failure": "выглядит как старая кладовка с предметами; культа не видно"
            }
        },
        {
            "description": "Реликвия ордена (ковчег с мумифицированным черепом святого)",
            "evidence": [
                "reliquary_skull"
            ],
            "check": {
                "skill": "Оккультизм",
                "dc": 20,
                "success": "игрок находит под алтарём ковчег с мумифицированным черепом — реликвия Ордена (украдена из храма в Мендеве, выкуплена культистами Дагона); ключ к миссии Художника",
                "failure": "под алтарём — только ткань/пыль; ковчег не замечен"
            }
        },
        {
            "description": "Ритуальный кинжал Врача",
            "evidence": [
                "doctor_dagger"
            ],
            "check": {
                "skill": "Внимательность",
                "dc": 15,
                "success": "игрок замечает за алтарём ритуальный кинжал Врача (символ культа Дагона)",
                "failure": "кинджаль не замечен"
            }
        },
        {
            "description": "Свеча из культа (записка к таверне)",
            "evidence": [
                "letter_to_tavern"
            ],
            "check": {
                "skill": "Внимательность",
                "dc": 12,
                "success": "игрок находит свечу/записку, связывающую культ с таверной",
                "failure": "ничего не замечено"
            }
        },
        {
            "description": "Печать культа",
            "evidence": [
                "cult_symbol"
            ],
            "check": {
                "skill": "Религия",
                "dc": 15,
                "success": "игрок распознаёт печать/символ культа Дагона (глаз в круге с щупальцами)",
                "failure": "просто символ; культа не распознаётся"
            }
        },
        {
            "description": "Запах благовоний",
            "evidence": [
                "poison_evidence"
            ],
            "check": {
                "skill": "Внимательность",
                "dc": 12,
                "success": "игрок замечает сильный запах благовоний/тёмной магии (Дагон) — признак культа",
                "failure": "просто пахнет воском и свечами"
            }
        }
    ]
}