{
    "id": "smuggler_storage",
    "name": "Тайный склад контрабандистов",
    "type": "gameplay",
    "parent_location": "basement",
    "description": "Тайный склад контрабанды: конкретные запрещённые PF2e-товары (см. organizations/smugglers.json, поле contraband; и улики devil_bane–070), спрятанные под стеллажом. Доступ через тайную дверь в подвале. Сюда приносят товар через второй вход с улицы (задняя сторона). Связан с кабинетом (tavern_keeper_office) — там счёты и записная книжка.",
    "characters": [
        "tavern_keeper",
        "sailor"
    ],
    "important_events": [
        "event_005"
    ],
    "clues": [
    ],
    "secrets": [
        "конкретная контрабанда (Devil's Bane, Pesh, Flayleaf, Grit — инструменты культа Дагона) спрятана под стеллажом",
        "второй вход с улицы (задняя сторона) для незаметной загрузки/разгрузки",
        "связь с кабинетом (tavern_keeper_office): счёты и записная книжка"
    ],
    "mechanical_features": [
        "тайная дверь",
        "скрытые товары под стеллажом",
        "второй вход с улицы",
        "связь с кабинетом (tavern_keeper_office)"
    ],
    "appearance": "Тёмное, тесное помещение за тайной дверью. Каменные стены, низкий потолок. Вдоль стен — стеллажи с товарами, прикрытыми тканью. В углу — ящики с конкретными запрещёнными товарами: склянки с мазью «Погибель Дьявола» (Devil's Bane), связки пеша (Pesh), пучки лист-живодёра (Flayleaf), пузырьки с грязью (Grit), а также специи и табак. На полу — лужи от протечек. Свет — от масляной лампы. Пахнет солью, специями, табаком и чем-то галлюциногенным.",
    "senses": {
        "feeling": "теснота, тайна, запрет",
        "smell": "мазь «Погибель Дьявола», пеш, лист-живодёр, специи, сырость",
        "sound": "капли воды, скрип стеллажей"
    },
    "hidden": [
        {
            "description": "Счёт за контрабанду (накладная с подписью Моряка)",
            "evidence": [
                "contraband_crate"
            ],
            "check": {
                "skill": "Внимательность",
                "dc": 12,
                "success": "игрок находит накладную на запрещённые товары с подписью Моряка — деловая связь Моряка и Трактирщика",
                "failure": "под стеллажом — только товар; документа нет"
            }
        },
        {
            "description": "«Погибель Дьявола» (Devil's Bane) — мазь на оружие против дьяволов",
            "evidence": [
                "devil_bane"
            ],
            "check": {
                "skill": "Интеллект",
                "dc": 15,
                "success": "игрок узнаёт мазь «Погибель Дьявола» (Devil's Bane, 100 gp/доза) — запрещённый в Челии инструмент культа Дагона",
                "failure": "просто склянки с мазью; назначения неясно"
            }
        },
        {
            "description": "Пеш (Pesh) — наркотик из кактуса Катапеша",
            "evidence": [
                "pesh"
            ],
            "check": {
                "skill": "Интеллект",
                "dc": 15,
                "success": "игрок узнаёт пеш (Pesh) — галлюциноген/эйфория, запрещённый товар",
                "failure": "просто связки травы; что это — неясно"
            }
        },
        {
            "description": "Лист-живодёр (Flayleaf) — седатив/внушение",
            "evidence": [
                "flayleaf"
            ],
            "check": {
                "skill": "Интеллект",
                "dc": 15,
                "success": "игрок узнаёт лист-живодёр (Flayleaf) — седатив/внушение (подавление воли), запрещённый товар",
                "failure": "просто пучки листьев; назначения неясно"
            }
        },
        {
            "description": "Грязь (Grit) — берсерк/ярость",
            "evidence": [
                "grit"
            ],
            "check": {
                "skill": "Интеллект",
                "dc": 15,
                "success": "игрок узнаёт грязь (Grit) — берсерк/ярость, запрещённый товар",
                "failure": "просто пузырьки; назначения неясно"
            }
        },
        {
            "description": "Сломанный нож (порванная записка)",
            "evidence": [
                "torn_letter"
            ],
            "check": {
                "skill": "Внимательность",
                "dc": 12,
                "success": "игрок находит порванную записку/следы сломанного ножа — ложный след орудия",
                "failure": "ничего не замечено"
            }
        },
        {
            "description": "Нож Моряка",
            "evidence": [
                "sailor_knife"
            ],
            "check": {
                "skill": "Внимательность",
                "dc": 12,
                "success": "игрок находит нож Моряка среди контрабанды — ложный след орудия (не связан с текущим убийством)",
                "failure": "нуж не замечен"
            }
        }
    ]
}
